{
  "$schema": "https://json-schema.org/draft/2020-12/schema",
  "$id": "https://beyond-prompting.example/registry/schemas/registry.schema.json",
  "title": "Registry manifest",
  "description": "The registry manifest pins the registry version, the registry reference date and the verification-freshness policy. The reference date makes staleness checking deterministic: a control is stale when its last verification is older than max_verification_age_days before as_of. The manifest carries no wall-clock time of its own.",
  "type": "object",
  "additionalProperties": false,
  "required": ["schema", "registry_version", "title", "description", "as_of", "policy"],
  "properties": {
    "schema": {"const": "beyond-prompting/registry@1"},
    "registry_version": {"$ref": "https://beyond-prompting.example/registry/schemas/common.schema.json#/$defs/version"},
    "title": {"$ref": "https://beyond-prompting.example/registry/schemas/common.schema.json#/$defs/short_string"},
    "description": {"type": "string", "minLength": 1, "maxLength": 1000},
    "as_of": {
      "description": "Registry reference date. Every last_verification date must fall within the freshness policy window ending at this date.",
      "$ref": "https://beyond-prompting.example/registry/schemas/common.schema.json#/$defs/date"
    },
    "policy": {
      "type": "object",
      "additionalProperties": false,
      "required": ["max_verification_age_days"],
      "properties": {
        "max_verification_age_days": {"type": "integer", "minimum": 1, "maximum": 3650}
      }
    }
  }
}
